{
  "session_contract": "world-v6.brain-council.v1",
  "max_rounds": 2,
  "minimum_support_millis": 750,
  "blind_first_round": true,
  "context_binding_required": true,
  "high_risk_veto": true,
  "proposal_only": true,
  "participants": [
    {"participant_id": "brain-domain", "role": "DOMAIN", "weight_millis": 1000, "veto_capable": false},
    {"participant_id": "brain-risk", "role": "RISK", "weight_millis": 1200, "veto_capable": true},
    {"participant_id": "brain-policy", "role": "POLICY", "weight_millis": 1200, "veto_capable": true}
  ]
}
